{
  "version": "v1",
  "created_at": "2026-04-09T00:00:00Z",
  "chapter_id": "demo/chapter-001",
  "source_images": [
    "pages/page_000.png"
  ],
  "panels": [
    {
      "panel_id": "ch001_p000_n000_57fbe44e93",
      "page_idx": 0,
      "bbox": [0.277, 0.3935, 376.997, 299.4535],
      "crop_path": "final/panels/ch001_p000_n000_57fbe44e93.png",
      "ocr_lines": [
        {
          "text": "You're right! It's easier and tastier!",
          "confidence": 0.85
        }
      ],
      "scene_caption": "A couple and their child eat at a restaurant.",
      "scene_tags": ["family", "eating", "restaurant", "couple", "dinner"]
    }
  ],
  "beats": [
    {
      "beat_id": "b000",
      "panel_ids": ["ch001_p000_n000_57fbe44e93"],
      "summary": "A family is eating together; dialogue is present but the main action is mealtime.",
      "status": "OK"
    }
  ],
  "script": [
    {
      "line_id": "l000",
      "beat_id": "b000",
      "panel_ids": ["ch001_p000_n000_57fbe44e93"],
      "text": "They share a quiet meal together as the conversation continues.",
      "status": "OK",
      "notes": "Narrator-style glue; keep strictly grounded to scene_caption + OCR.",
      "audio_path": "final/audio/l000.wav",
      "start_s": 0.0,
      "end_s": 3.2
    }
  ]
}

